{"baseSha":"aaaaaaaaaaaaaaaaaaaaaaaaaaaaaaaaaaaaaaaa","blocker":null,"branch":"cb/run/alpha","changedFiles":[{"changeType":"modified","path":"src/alpha/model.py","sourcePath":null}],"checks":[{"command":"python -m unittest tests.test_alpha -v","evidenceDigest":"sha256:aaaaaaaaaaaaaaaaaaaaaaaaaaaaaaaaaaaaaaaaaaaaaaaaaaaaaaaaaaaaaaaa","name":"focused tests","status":"passed"}],"commitSha":"bbbbbbbbbbbbbbbbbbbbbbbbbbbbbbbbbbbbbbbb","effort":"low","elapsedMs":1200,"exactModel":"gpt-5.6-sol","headSha":"bbbbbbbbbbbbbbbbbbbbbbbbbbbbbbbbbbbbbbbb","runId":"cb-20260901-0123456789abcdef","schemaVersion":"compass-builder.worker-receipt.v1","status":"succeeded","storyId":"alpha","worktree":"C:\\workspace\\Plugin Compass\\.compass-builder\\worktrees\\run\\alpha"}
